{
  "id": "polaroid-frame",
  "title": "Instant Polaroid frame",
  "prompt": "Restyle as an instant Polaroid photo: thick white border, soft flash lighting, slight vintage color cast, handwritten date in the bottom margin, intimate snapshot feel, film grain.",
  "feature": "retouch",
  "settings": {
    "aspectRatio": "1:1",
    "tab": "retouch"
  },
  "thumbnail": "examples/viral/polaroid.webp",
  "description": "Viral Polaroid frame retouch preset.",
  "author": "bloom-render",
  "tags": ["retouch", "polaroid", "viral"]
}
